{
  "kit": "0.1.0",
  "profiles": [
    "python-cli"
  ],
  "preset": "quick",
  "agents": [
    "claude"
  ],
  "vendored": false,
  "modules": {
    "core": {
      "enabled": true
    },
    "communication": {
      "enabled": true
    },
    "standards": {
      "enabled": true
    },
    "devenv": {
      "enabled": true
    },
    "tasks": {
      "enabled": true,
      "mode": "local"
    }
  },
  "mcpServers": [],
  "files": [
    {
      "path": "AGENTS.md",
      "module": "core",
      "hash": "sha256:a54ff182c7e8acf56acfd6e4b9c3ff41e2c41a31c9b211b2deb9df75d9a478f9",
      "managed": true,
      "fragments": [
        {
          "module": "communication",
          "hash": "sha256:d4e16994df9002e53294f899714d7137592fd13ba986fcd070214dc85d659968"
        },
        {
          "module": "standards",
          "hash": "sha256:0b21aaddae93d0233f598f4d15c6bdc695206094e89cba27044e721a83c79219"
        },
        {
          "module": "tasks",
          "hash": "sha256:085154084c7427596104bc42f51f59f6d3ffd3d5f49f098210c20449fb7b2c71"
        }
      ]
    },
    {
      "path": "CLAUDE.md",
      "module": "core",
      "hash": "sha256:6ebdb617a8104a7756d0cf36578ab01103dc9f07e4dc6feb751296b9c402faf7",
      "managed": true
    },
    {
      "path": "justfile",
      "module": "core",
      "hash": "sha256:deb9bb56fb122db0b605aa5b63f95a4665c905b18dd670e1fa6c877576a94ff1",
      "managed": true,
      "fragments": [
        {
          "module": "devenv",
          "hash": "sha256:76bb5cdb2589a31ebaea6caff1d80156c6a136b19818fa10a656080d1c99c546"
        }
      ]
    },
    {
      "path": "TASKS.md",
      "module": "tasks",
      "hash": "sha256:66ee26543c5fa02b0db4d04d72834581c54f595e095f50d3a5f86a1d6bdb63b0",
      "managed": false
    },
    {
      "path": ".env.example",
      "module": "devenv",
      "hash": "sha256:a3046da0d15a27e89f2afe639b25748a7ad4d9290af3e7b1b6c1a5533c8f0a8c",
      "managed": true
    },
    {
      "path": ".yaw/answers.yaml",
      "module": "core",
      "hash": "sha256:677fe21b65f4a6cf1d105853d51f4f0a562698aa6374cb4d279d46a99dd3e6a3",
      "managed": false
    }
  ]
}
